{
  "kind": "vocabulary_bindings",
  "schemaVersion": "0.1.0",
  "id": "synthetic-motion-bindings",
  "bindings": [
    {
      "id": "index-statement",
      "recordedAt": "2026-09-08T00:00:00Z",
      "assignedBy": "person:synthetic-curator",
      "rationale": "Index the source statement by its motion topic without adopting the source wording as an assessed result.",
      "claim": {
        "document": {
          "documentId": "synthetic-history",
          "schemaId": "urn:disclosureos:experimental:claim-history:0.1.0",
          "sha256": "54c10361bd1260db54bb0146a2f4646bda1f96c62ac75c5fcaf9359664cd6077"
        },
        "claimId": "statement-1"
      },
      "relation": "about",
      "term": {
        "catalogId": "urn:example:disclosureos:review:vocabulary:motion",
        "revision": "illustration-1",
        "document": {
          "documentId": "synthetic-motion-catalog",
          "schemaId": "urn:disclosureos:experimental:vocabulary-catalog:0.1.0",
          "sha256": "83d2f082eb1df6ebad5d833e959eb32c8f1b90fae63ba6a8a78356cec5f395a5"
        },
        "termId": "radial_motion"
      }
    },
    {
      "id": "index-review",
      "recordedAt": "2026-09-08T00:00:00Z",
      "assignedBy": "person:synthetic-curator",
      "rationale": "Index this review under the same motion term; this association does not declare what definition the evaluator used.",
      "claim": {
        "document": {
          "documentId": "synthetic-history",
          "schemaId": "urn:disclosureos:experimental:claim-history:0.1.0",
          "sha256": "54c10361bd1260db54bb0146a2f4646bda1f96c62ac75c5fcaf9359664cd6077"
        },
        "claimId": "review-2"
      },
      "relation": "about",
      "term": {
        "catalogId": "urn:example:disclosureos:review:vocabulary:motion",
        "revision": "illustration-1",
        "document": {
          "documentId": "synthetic-motion-catalog",
          "schemaId": "urn:disclosureos:experimental:vocabulary-catalog:0.1.0",
          "sha256": "83d2f082eb1df6ebad5d833e959eb32c8f1b90fae63ba6a8a78356cec5f395a5"
        },
        "termId": "radial_motion"
      }
    },
    {
      "id": "declare-review-criterion",
      "recordedAt": "2026-09-08T00:00:00Z",
      "assignedBy": "person:synthetic-reviewer",
      "rationale": "Synthetic later declaration of the term addressed by this review. The retained result remains inconclusive; this term defines no anomaly threshold.",
      "claim": {
        "document": {
          "documentId": "synthetic-history",
          "schemaId": "urn:disclosureos:experimental:claim-history:0.1.0",
          "sha256": "54c10361bd1260db54bb0146a2f4646bda1f96c62ac75c5fcaf9359664cd6077"
        },
        "claimId": "review-2"
      },
      "relation": "assessment_criterion",
      "term": {
        "catalogId": "urn:example:disclosureos:review:vocabulary:motion",
        "revision": "illustration-1",
        "document": {
          "documentId": "synthetic-motion-catalog",
          "schemaId": "urn:disclosureos:experimental:vocabulary-catalog:0.1.0",
          "sha256": "83d2f082eb1df6ebad5d833e959eb32c8f1b90fae63ba6a8a78356cec5f395a5"
        },
        "termId": "radial_motion"
      }
    }
  ]
}
